{
  "tc_id": "TC-031",
  "tc_name": "Time-to-First-Treatment",
  "metadata": {
    "n_total": 190,
    "n_experimental": 96,
    "n_control": 94,
    "population": "ITT",
    "time_unit": "days",
    "censoring_rule": "subjects who never receive treatment are censored at follow-up time",
    "r_version": "R version 4.6.1 (2026-06-24)"
  },
  "km_median_ttt": {
    "experimental": {
      "median": 3.5,
      "ci_lower": 3,
      "ci_upper": 4,
      "n_events": 92,
      "n_total": 96,
      "estimable": true
    },
    "control": {
      "median": 5,
      "ci_lower": 4,
      "ci_upper": 6,
      "n_events": 88,
      "n_total": 94,
      "estimable": true
    }
  },
  "logrank_test": {
    "chisq": 11.0604,
    "df": 1,
    "p_value": 0.0009
  },
  "cox_hr": {
    "hr": 1.6925,
    "hr_lower": 1.2531,
    "hr_upper": 2.2858,
    "p_value": 0.0006,
    "n": 190
  },
  "ttt_summary": {
    "experimental": {
      "n": 96,
      "mean": 8.5938,
      "sd": 28.9481,
      "median": 3.5,
      "min": 0,
      "max": 217,
      "q1": 2,
      "q3": 5
    },
    "control": {
      "n": 94,
      "mean": 13.1809,
      "sd": 33.9706,
      "median": 5,
      "min": 0,
      "max": 190,
      "q1": 2.25,
      "q3": 7
    }
  },
  "received_treatment": {
    "experimental": {
      "n_received": 92,
      "n_censored": 4,
      "pct_received": 95.83
    },
    "control": {
      "n_received": 88,
      "n_censored": 6,
      "pct_received": 93.62
    }
  },
  "per_subject": [
    {
      "USUBJID": "SUB0002",
      "TRT01A": "Experimental",
      "RANDDT": "2023-08-27",
      "FIRSTDOSEDT": "2023-08-31",
      "TTT_DAYS": 4,
      "TTT_MONTHS": 0.1314,
      "RECEIVED_TX": 1,
      "CNSR_TTT": 0
    },
    {
      "USUBJID": "SUB0003",
      "TRT01A": "Control",
      "RANDDT": "2023-10-11",
      "FIRSTDOSEDT": "2023-10-16",
      "TTT_DAYS": 5,
      "TTT_MONTHS": 0.1643,
      "RECEIVED_TX": 1,
      "CNSR_TTT": 0
    },
    {
      "USUBJID": "SUB0004",
      "TRT01A": "Experimental",
      "RANDDT": "2023-09-09",
      "FIRSTDOSEDT": "2023-09-09",
      "TTT_DAYS": 0,
      "TTT_MONTHS": 0,
      "RECEIVED_TX": 1,
      "CNSR_TTT": 0
    },
    {
      "USUBJID": "SUB0005",
      "TRT01A": "Control",
      "RANDDT": "2023-04-03",
      "FIRSTDOSEDT": "2023-04-05",
      "TTT_DAYS": 2,
      "TTT_MONTHS": 0.0657,
      "RECEIVED_TX": 1,
      "CNSR_TTT": 0
    },
    {
      "USUBJID": "SUB0006",
      "TRT01A": "Control",
      "RANDDT": "2023-11-09",
      "FIRSTDOSEDT": "2023-11-13",
      "TTT_DAYS": 4,
      "TTT_MONTHS": 0.1314,
      "RECEIVED_TX": 1,
      "CNSR_TTT": 0
    },
    {
      "USUBJID": "SUB0007",
      "TRT01A": "Control",
      "RANDDT": "2023-03-25",
      "FIRSTDOSEDT": "2023-03-27",
      "TTT_DAYS": 2,
      "TTT_MONTHS": 0.0657,
      "RECEIVED_TX": 1,
      "CNSR_TTT": 0
    },
    {
      "USUBJID": "SUB0008",
      "TRT01A": "Control",
      "RANDDT": "2023-08-13",
      "FIRSTDOSEDT": "2023-08-13",
      "TTT_DAYS": 0,
      "TTT_MONTHS": 0,
      "RECEIVED_TX": 1,
      "CNSR_TTT": 0
    },
    {
      "USUBJID": "SUB0009",
      "TRT01A": "Experimental",
      "RANDDT": "2023-03-02",
      "FIRSTDOSEDT": "2023-03-06",
      "TTT_DAYS": 4,
      "TTT_MONTHS": 0.1314,
      "RECEIVED_TX": 1,
      "CNSR_TTT": 0
    },
    {
      "USUBJID": "SUB0010",
      "TRT01A": "Experimental",
      "RANDDT": "2023-04-12",
      "FIRSTDOSEDT": "2023-04-15",
      "TTT_DAYS": 3,
      "TTT_MONTHS": 0.0986,
      "RECEIVED_TX": 1,
      "CNSR_TTT": 0
    },
    {
      "USUBJID": "SUB0011",
      "TRT01A": "Experimental",
      "RANDDT": "2023-06-20",
      "FIRSTDOSEDT": "2023-06-28",
      "TTT_DAYS": 8,
      "TTT_MONTHS": 0.2628,
      "RECEIVED_TX": 1,
      "CNSR_TTT": 0
    },
    {
      "USUBJID": "SUB0012",
      "TRT01A": "Experimental",
      "RANDDT": "2023-05-30",
      "FIRSTDOSEDT": "2023-06-03",
      "TTT_DAYS": 4,
      "TTT_MONTHS": 0.1314,
      "RECEIVED_TX": 1,
      "CNSR_TTT": 0
    },
    {
      "USUBJID": "SUB0013",
      "TRT01A": "Experimental",
      "RANDDT": "2023-07-01",
      "FIRSTDOSEDT": "2023-07-06",
      "TTT_DAYS": 5,
      "TTT_MONTHS": 0.1643,
      "RECEIVED_TX": 1,
      "CNSR_TTT": 0
    },
    {
      "USUBJID": "SUB0014",
      "TRT01A": "Control",
      "RANDDT": "2023-11-06",
      "FIRSTDOSEDT": "2023-11-14",
      "TTT_DAYS": 8,
      "TTT_MONTHS": 0.2628,
      "RECEIVED_TX": 1,
      "CNSR_TTT": 0
    },
    {
      "USUBJID": "SUB0015",
      "TRT01A": "Control",
      "RANDDT": "2023-02-24",
      "FIRSTDOSEDT": "2023-02-26",
      "TTT_DAYS": 2,
      "TTT_MONTHS": 0.0657,
      "RECEIVED_TX": 1,
      "CNSR_TTT": 0
    },
    {
      "USUBJID": "SUB0016",
      "TRT01A": "Experimental",
      "RANDDT": "2023-02-23",
      "FIRSTDOSEDT": "2023-02-25",
      "TTT_DAYS": 2,
      "TTT_MONTHS": 0.0657,
      "RECEIVED_TX": 1,
      "CNSR_TTT": 0
    },
    {
      "USUBJID": "SUB0017",
      "TRT01A": "Control",
      "RANDDT": "2023-11-10",
      "FIRSTDOSEDT": "2023-11-10",
      "TTT_DAYS": 0,
      "TTT_MONTHS": 0,
      "RECEIVED_TX": 1,
      "CNSR_TTT": 0
    },
    {
      "USUBJID": "SUB0018",
      "TRT01A": "Control",
      "RANDDT": "2023-06-22",
      "FIRSTDOSEDT": "2023-06-22",
      "TTT_DAYS": 0,
      "TTT_MONTHS": 0,
      "RECEIVED_TX": 1,
      "CNSR_TTT": 0
    },
    {
      "USUBJID": "SUB0019",
      "TRT01A": "Control",
      "RANDDT": "2023-02-12",
      "FIRSTDOSEDT": "2023-02-17",
      "TTT_DAYS": 5,
      "TTT_MONTHS": 0.1643,
      "RECEIVED_TX": 1,
      "CNSR_TTT": 0
    },
    {
      "USUBJID": "SUB0021",
      "TRT01A": "Experimental",
      "RANDDT": "2023-03-26",
      "FIRSTDOSEDT": "2023-03-27",
      "TTT_DAYS": 1,
      "TTT_MONTHS": 0.0329,
      "RECEIVED_TX": 1,
      "CNSR_TTT": 0
    },
    {
      "USUBJID": "SUB0022",
      "TRT01A": "Control",
      "RANDDT": "2023-06-02",
      "FIRSTDOSEDT": "2023-06-10",
      "TTT_DAYS": 8,
      "TTT_MONTHS": 0.2628,
      "RECEIVED_TX": 1,
      "CNSR_TTT": 0
    },
    {
      "USUBJID": "SUB0023",
      "TRT01A": "Experimental",
      "RANDDT": "2023-12-24",
      "FIRSTDOSEDT": "2023-12-27",
      "TTT_DAYS": 3,
      "TTT_MONTHS": 0.0986,
      "RECEIVED_TX": 1,
      "CNSR_TTT": 0
    },
    {
      "USUBJID": "SUB0024",
      "TRT01A": "Control",
      "RANDDT": "2023-08-28",
      "FIRSTDOSEDT": "2023-08-30",
      "TTT_DAYS": 2,
      "TTT_MONTHS": 0.0657,
      "RECEIVED_TX": 1,
      "CNSR_TTT": 0
    },
    {
      "USUBJID": "SUB0025",
      "TRT01A": "Control",
      "RANDDT": "2023-02-18",
      "FIRSTDOSEDT": "2023-02-26",
      "TTT_DAYS": 8,
      "TTT_MONTHS": 0.2628,
      "RECEIVED_TX": 1,
      "CNSR_TTT": 0
    },
    {
      "USUBJID": "SUB0026",
      "TRT01A": "Experimental",
      "RANDDT": "2023-05-19",
      "FIRSTDOSEDT": "2023-05-20",
      "TTT_DAYS": 1,
      "TTT_MONTHS": 0.0329,
      "RECEIVED_TX": 1,
      "CNSR_TTT": 0
    },
    {
      "USUBJID": "SUB0027",
      "TRT01A": "Control",
      "RANDDT": "2023-06-05",
      "FIRSTDOSEDT": "2023-06-08",
      "TTT_DAYS": 3,
      "TTT_MONTHS": 0.0986,
      "RECEIVED_TX": 1,
      "CNSR_TTT": 0
    },
    {
      "USUBJID": "SUB0028",
      "TRT01A": "Experimental",
      "RANDDT": "2023-10-01",
      "FIRSTDOSEDT": "2023-10-04",
      "TTT_DAYS": 3,
      "TTT_MONTHS": 0.0986,
      "RECEIVED_TX": 1,
      "CNSR_TTT": 0
    },
    {
      "USUBJID": "SUB0029",
      "TRT01A": "Control",
      "RANDDT": "2023-02-24",
      "FIRSTDOSEDT": "2023-02-28",
      "TTT_DAYS": 4,
      "TTT_MONTHS": 0.1314,
      "RECEIVED_TX": 1,
      "CNSR_TTT": 0
    },
    {
      "USUBJID": "SUB0030",
      "TRT01A": "Experimental",
      "RANDDT": "2023-08-14",
      "FIRSTDOSEDT": "2023-08-18",
      "TTT_DAYS": 4,
      "TTT_MONTHS": 0.1314,
      "RECEIVED_TX": 1,
      "CNSR_TTT": 0
    },
    {
      "USUBJID": "SUB0031",
      "TRT01A": "Experimental",
      "RANDDT": "2023-09-07",
      "FIRSTDOSEDT": "2023-09-10",
      "TTT_DAYS": 3,
      "TTT_MONTHS": 0.0986,
      "RECEIVED_TX": 1,
      "CNSR_TTT": 0
    },
    {
      "USUBJID": "SUB0032",
      "TRT01A": "Experimental",
      "RANDDT": "2023-06-19",
      "FIRSTDOSEDT": "2023-06-22",
      "TTT_DAYS": 3,
      "TTT_MONTHS": 0.0986,
      "RECEIVED_TX": 1,
      "CNSR_TTT": 0
    },
    {
      "USUBJID": "SUB0033",
      "TRT01A": "Control",
      "RANDDT": "2023-10-19",
      "FIRSTDOSEDT": "2023-10-21",
      "TTT_DAYS": 2,
      "TTT_MONTHS": 0.0657,
      "RECEIVED_TX": 1,
      "CNSR_TTT": 0
    },
    {
      "USUBJID": "SUB0034",
      "TRT01A": "Control",
      "RANDDT": "2023-05-28",
      "FIRSTDOSEDT": "2023-05-30",
      "TTT_DAYS": 2,
      "TTT_MONTHS": 0.0657,
      "RECEIVED_TX": 1,
      "CNSR_TTT": 0
    },
    {
      "USUBJID": "SUB0035",
      "TRT01A": "Experimental",
      "RANDDT": "2023-07-26",
      "FIRSTDOSEDT": "2023-07-30",
      "TTT_DAYS": 4,
      "TTT_MONTHS": 0.1314,
      "RECEIVED_TX": 1,
      "CNSR_TTT": 0
    },
    {
      "USUBJID": "SUB0036",
      "TRT01A": "Control",
      "RANDDT": "2023-07-08",
      "FIRSTDOSEDT": "2023-07-14",
      "TTT_DAYS": 6,
      "TTT_MONTHS": 0.1971,
      "RECEIVED_TX": 1,
      "CNSR_TTT": 0
    },
    {
      "USUBJID": "SUB0037",
      "TRT01A": "Control",
      "RANDDT": "2023-11-23",
      "FIRSTDOSEDT": "2023-11-24",
      "TTT_DAYS": 1,
      "TTT_MONTHS": 0.0329,
      "RECEIVED_TX": 1,
      "CNSR_TTT": 0
    },
    {
      "USUBJID": "SUB0038",
      "TRT01A": "Control",
      "RANDDT": "2023-04-23",
      "FIRSTDOSEDT": "2023-04-27",
      "TTT_DAYS": 4,
      "TTT_MONTHS": 0.1314,
      "RECEIVED_TX": 1,
      "CNSR_TTT": 0
    },
    {
      "USUBJID": "SUB0039",
      "TRT01A": "Control",
      "RANDDT": "2023-01-27",
      "FIRSTDOSEDT": "2023-02-02",
      "TTT_DAYS": 6,
      "TTT_MONTHS": 0.1971,
      "RECEIVED_TX": 1,
      "CNSR_TTT": 0
    },
    {
      "USUBJID": "SUB0040",
      "TRT01A": "Experimental",